{
    "_id": "lysithea",
    "name": "Lysithea",
    "portraitUrl": "characters/portrait/lysithea.png",
    "gifts": [
        "tasty-baked-treat",
        "lily",
        "armored-bear-stuffy",
        "arithmetic-textbook",
        "book-of-crest-designs"
    ],
    "lostItems": ["encyclopediaOfSweets", "princessDoll", "newBottleOfPerfume"],
    "meals": {
        "liked": ["peachSorbet"],
        "disliked": ["friedCrayfish"]
    },
    "routes": [
        {
            "id": "white-clouds",
            "chapters": [
                {
                    "available": true
                },
                {
                    "available": true
                },
                {
                    "available": true
                },
                {
                    "available": true
                },
                {
                    "available": true
                },
                {
                    "available": true
                },
                {
                    "available": true
                },
                {
                    "available": true
                },
                {
                    "available": true
                },
                {
                    "available": true
                }
            ]
        }
    ]
}
